{
  "$schema": "generated-c-maintainability-policy.schema.json",
  "schemaVersion": 1,
  "policyId": "hxc-generated-c-maintainability-v1",
  "correctnessPrecondition": "semantic-native-eval-gates-are-independent-and-overriding",
  "gotoCategories": [
    "irreducible-cfg",
    "loop-break-through-switch"
  ],
  "corpora": [
    {
      "corpusId": "body-lowering",
      "layout": "canonical",
      "limits": {
        "maxIdentifierBytes": 80,
        "maxFileLines": 160,
        "maxFunctionLines": 48,
        "maxBranchCount": 8,
        "maxNestingDepth": 6,
        "maxTemporaryDeclarations": 16,
        "maxTemporaryReferences": 16,
        "maxTemporaryDeclarationsPerKFunctionLines": 500,
        "maxFunctionTemporaryDeclarationsPerKLines": 650,
        "maxUnexplainedRoleEncodedIdentifiers": 0,
        "maxUnexplainedByteEscapedIdentifiers": 0,
        "maxUnexplainedDigestIdentifiers": 0,
        "maxUnexplainedHashSuffixIdentifiers": 0,
        "minOwnerMappedArtifactsBasisPoints": 10000,
        "minFunctionIdentityMappedBasisPoints": 10000,
        "minSourceSpanMappedFunctionsBasisPoints": 10000,
        "minLineDirectiveCount": 1
      },
      "gotoLimits": [
        {
          "category": "irreducible-cfg",
          "maxOccurrences": 0
        },
        {
          "category": "loop-break-through-switch",
          "maxOccurrences": 0
        }
      ],
      "fileOverrides": [
        {
          "path": "body-lines.c",
          "maxFileLines": 220,
          "reason": "The focused source-mapping artifact pairs one structured #line directive with each emitted source region. Its reviewed corpus includes straight-line, branch, early-return, and loop definite-assignment cases in addition to the ordinary primitive-body fixtures."
        }
      ],
      "functionOverrides": []
    },
    {
      "corpusId": "caxecraft-domain",
      "layout": "package",
      "limits": {
        "maxIdentifierBytes": 64,
        "maxFileLines": 400,
        "maxFunctionLines": 400,
        "maxBranchCount": 40,
        "maxNestingDepth": 8,
        "maxTemporaryDeclarations": 531,
        "maxTemporaryReferences": 800,
        "maxTemporaryDeclarationsPerKFunctionLines": 300,
        "maxFunctionTemporaryDeclarationsPerKLines": 500,
        "maxUnexplainedRoleEncodedIdentifiers": 0,
        "maxUnexplainedByteEscapedIdentifiers": 0,
        "maxUnexplainedDigestIdentifiers": 0,
        "maxUnexplainedHashSuffixIdentifiers": 0,
        "minOwnerMappedArtifactsBasisPoints": 10000,
        "minFunctionIdentityMappedBasisPoints": 10000,
        "minSourceSpanMappedFunctionsBasisPoints": 7500,
        "minLineDirectiveCount": 0
      },
      "gotoLimits": [
        {
          "category": "irreducible-cfg",
          "maxOccurrences": 0
        },
        {
          "category": "loop-break-through-switch",
          "maxOccurrences": 0
        }
      ],
      "fileOverrides": [
        {
          "path": "src/packages/caxecraft/domain/package.c",
          "maxFileLines": 1474,
          "reason": "Package layout intentionally groups the reviewed production domain modules into one package source. Five exhaustive World enum switches each carry a four-line defensive default that aborts if foreign C supplies an invalid enum value; valid Haxe behavior and the per-function control-flow limits remain unchanged."
        },
        {
          "path": "src/packages/caxecraft/qa/package.c",
          "maxFileLines": 633,
          "reason": "The QA package intentionally keeps the complete end-to-end domain oracle together. Its two added lines hold the reviewed read-only world view beside the mutable fixture storage; the corresponding function override remains separately bounded."
        }
      ],
      "functionOverrides": [
        {
          "functionId": "caxecraft.qa.DomainProbe.selfCheck",
          "maxFunctionLines": 587,
          "maxBranchCount": 83,
          "maxNestingDepth": 8,
          "maxFunctionTemporaryDeclarationsPerKLines": 500,
          "reason": "The QA-only self-check is a deliberate aggregate oracle. Two added lines hold the reviewed read-only world view beside mutable fixture storage; production domain functions remain under the ordinary budget."
        }
      ]
    },
    {
      "corpusId": "caxecraft-domain",
      "layout": "split",
      "limits": {
        "maxIdentifierBytes": 64,
        "maxFileLines": 400,
        "maxFunctionLines": 400,
        "maxBranchCount": 40,
        "maxNestingDepth": 8,
        "maxTemporaryDeclarations": 531,
        "maxTemporaryReferences": 800,
        "maxTemporaryDeclarationsPerKFunctionLines": 300,
        "maxFunctionTemporaryDeclarationsPerKLines": 500,
        "maxUnexplainedRoleEncodedIdentifiers": 0,
        "maxUnexplainedByteEscapedIdentifiers": 0,
        "maxUnexplainedDigestIdentifiers": 0,
        "maxUnexplainedHashSuffixIdentifiers": 0,
        "minOwnerMappedArtifactsBasisPoints": 10000,
        "minFunctionIdentityMappedBasisPoints": 10000,
        "minSourceSpanMappedFunctionsBasisPoints": 7500,
        "minLineDirectiveCount": 0
      },
      "gotoLimits": [
        {
          "category": "irreducible-cfg",
          "maxOccurrences": 0
        },
        {
          "category": "loop-break-through-switch",
          "maxOccurrences": 0
        }
      ],
      "fileOverrides": [
        {
          "path": "src/modules/caxecraft/domain/World.c",
          "maxFileLines": 427,
          "reason": "The finite world module keeps every stable solid-material storage code and edit rule together. Five exhaustive enum switches each carry a four-line defensive default that aborts if foreign C supplies an invalid enum value; valid Haxe behavior and the per-function control-flow limits remain unchanged."
        },
        {
          "path": "src/modules/caxecraft/qa/DomainProbe.c",
          "maxFileLines": 633,
          "reason": "The QA probe intentionally keeps the complete end-to-end domain oracle in one source-owned module. Its two added lines hold the reviewed read-only world view beside the mutable fixture storage; the corresponding function override remains separately bounded."
        }
      ],
      "functionOverrides": [
        {
          "functionId": "caxecraft.qa.DomainProbe.selfCheck",
          "maxFunctionLines": 587,
          "maxBranchCount": 83,
          "maxNestingDepth": 8,
          "maxFunctionTemporaryDeclarationsPerKLines": 500,
          "reason": "The QA-only self-check is a deliberate aggregate oracle. Two added lines hold the reviewed read-only world view beside mutable fixture storage; production domain functions remain under the ordinary budget."
        }
      ]
    },
    {
      "corpusId": "caxecraft-domain",
      "layout": "unity",
      "limits": {
        "maxIdentifierBytes": 64,
        "maxFileLines": 400,
        "maxFunctionLines": 400,
        "maxBranchCount": 40,
        "maxNestingDepth": 8,
        "maxTemporaryDeclarations": 531,
        "maxTemporaryReferences": 800,
        "maxTemporaryDeclarationsPerKFunctionLines": 300,
        "maxFunctionTemporaryDeclarationsPerKLines": 500,
        "maxUnexplainedRoleEncodedIdentifiers": 0,
        "maxUnexplainedByteEscapedIdentifiers": 0,
        "maxUnexplainedDigestIdentifiers": 0,
        "maxUnexplainedHashSuffixIdentifiers": 0,
        "minOwnerMappedArtifactsBasisPoints": 10000,
        "minFunctionIdentityMappedBasisPoints": 10000,
        "minSourceSpanMappedFunctionsBasisPoints": 7500,
        "minLineDirectiveCount": 0
      },
      "gotoLimits": [
        {
          "category": "irreducible-cfg",
          "maxOccurrences": 0
        },
        {
          "category": "loop-break-through-switch",
          "maxOccurrences": 0
        }
      ],
      "fileOverrides": [
        {
          "path": "src/program.c",
          "maxFileLines": 2258,
          "reason": "Unity layout intentionally amalgamates the same reviewed split program into one translation unit. Five exhaustive World enum switches each carry a four-line defensive default that aborts if foreign C supplies an invalid enum value; valid Haxe behavior and the per-function control-flow limits remain unchanged."
        }
      ],
      "functionOverrides": [
        {
          "functionId": "caxecraft.qa.DomainProbe.selfCheck",
          "maxFunctionLines": 587,
          "maxBranchCount": 83,
          "maxNestingDepth": 8,
          "maxFunctionTemporaryDeclarationsPerKLines": 500,
          "reason": "The QA-only self-check is a deliberate aggregate oracle. Two added lines hold the reviewed read-only world view beside mutable fixture storage; production domain functions remain under the ordinary budget."
        }
      ]
    },
    {
      "corpusId": "evaluation-order-program",
      "layout": "canonical",
      "limits": {
        "maxIdentifierBytes": 96,
        "maxFileLines": 440,
        "maxFunctionLines": 320,
        "maxBranchCount": 48,
        "maxNestingDepth": 14,
        "maxTemporaryDeclarations": 120,
        "maxTemporaryReferences": 100,
        "maxTemporaryDeclarationsPerKFunctionLines": 500,
        "maxFunctionTemporaryDeclarationsPerKLines": 650,
        "maxUnexplainedRoleEncodedIdentifiers": 0,
        "maxUnexplainedByteEscapedIdentifiers": 0,
        "maxUnexplainedDigestIdentifiers": 0,
        "maxUnexplainedHashSuffixIdentifiers": 0,
        "minOwnerMappedArtifactsBasisPoints": 10000,
        "minFunctionIdentityMappedBasisPoints": 10000,
        "minSourceSpanMappedFunctionsBasisPoints": 9000,
        "minLineDirectiveCount": 0
      },
      "gotoLimits": [
        {
          "category": "irreducible-cfg",
          "maxOccurrences": 0
        },
        {
          "category": "loop-break-through-switch",
          "maxOccurrences": 0
        }
      ],
      "fileOverrides": [],
      "functionOverrides": []
    },
    {
      "corpusId": "evaluation-order-synthetic",
      "layout": "synthetic",
      "limits": {